{"application_protocol":{"maximum":1,"minimum":1},"build_id":"aaaaaaaaaaaaaaaaaaaaaaaaaaaaaaaaaaaaaaaa","config_schema":{"maximum":3,"minimum":2},"data_schema":{"maximum":3,"minimum":2},"entries":[{"mode":"0555","path":"app","sha256":null,"size":0,"target":null,"type":"directory"},{"mode":"0444","path":"app/main.js","sha256":"239f59ed55e737c77147cf55ad0c1b030b6d7ee748a7426952f9b852d5a935e5","size":7,"target":null,"type":"file"},{"mode":"0777","path":"current-main","sha256":null,"size":0,"target":"app/main.js","type":"symlink"},{"mode":"0444","path":"app/main-copy.js","sha256":null,"size":0,"target":"main.js","type":"hardlink"}],"launcher_protocol":{"maximum":1,"minimum":1},"platform":"linux-x86_64-nvidia","schema":"voice-agent.platform-artifact-manifest.v1","service_template_sha256":"bbbbbbbbbbbbbbbbbbbbbbbbbbbbbbbbbbbbbbbbbbbbbbbbbbbbbbbbbbbbbbbb","version":"1.2.3"}